{
  "$schema": "http://json-schema.org/draft-07/schema#",
  "$id": "https://goodboy.dev/schemas/manifest/1.0.0",
  "title": "GoodBoy Skill Manifest",
  "type": "object",
  "additionalProperties": false,
  "required": ["name", "version", "description", "author", "license", "schema_version", "status"],
  "properties": {
    "name": {
      "type": "string",
      "pattern": "^[a-z0-9-]+$",
      "minLength": 1,
      "maxLength": 64,
      "description": "Must match the skill directory name exactly. Lowercase letters, numbers, and hyphens only."
    },
    "version": {
      "type": "string",
      "pattern": "^\\d+\\.\\d+\\.\\d+$",
      "maxLength": 32,
      "description": "Semantic version (semver) of this skill"
    },
    "description": {
      "type": "string",
      "minLength": 1,
      "maxLength": 1024,
      "description": "What this skill does and when to use it. Used for registry search and display."
    },
    "author": {
      "type": "object",
      "additionalProperties": false,
      "required": ["name"],
      "properties": {
        "name": { "type": "string", "maxLength": 128 },
        "email": { "type": "string", "format": "email", "maxLength": 254 },
        "url": { "type": "string", "format": "uri", "maxLength": 2048 }
      }
    },
    "license": {
      "type": "string",
      "maxLength": 64,
      "description": "SPDX license identifier e.g. MIT, Apache-2.0"
    },
    "schema_version": {
      "type": "string",
      "pattern": "^1\\.\\d+\\.\\d+$",
      "maxLength": 32,
      "description": "GoodBoy manifest schema version, semver-shaped (v1.x only). CLIs tolerate a newer minor than they know, stripping unknown top-level fields with a warning; a newer major is rejected. See manifest.ts."
    },
    "status": {
      "type": "string",
      "enum": ["experimental", "stable", "deprecated"],
      "default": "experimental",
      "description": "Maturity signal for registry display and filtering"
    },
    "keywords": {
      "type": "array",
      "items": { "type": "string", "maxLength": 64 },
      "maxItems": 10,
      "uniqueItems": true,
      "description": "Free-form search terms"
    },
    "category": {
      "type": "string",
      "enum": ["code", "writing", "data", "devops", "testing", "documentation", "productivity", "security", "research", "other"],
      "description": "Primary category for registry browsing"
    },
    "tags": {
      "type": "array",
      "items": {
        "type": "string",
        "enum": ["code-review", "testing", "documentation", "git", "deployment", "security", "refactoring", "architecture", "debugging", "productivity", "writing", "data", "devops", "agent", "orchestration", "formatting", "analysis", "research", "workflow", "other"]
      },
      "maxItems": 5,
      "uniqueItems": true,
      "description": "Controlled vocabulary for registry faceted search. Unlike keywords, tags are a fixed enumeration owned by GoodBoy."
    },
    "homepage": {
      "type": "string",
      "format": "uri",
      "maxLength": 2048
    },
    "repository": {
      "type": "object",
      "additionalProperties": false,
      "properties": {
        "type": { "type": "string", "maxLength": 32 },
        "url": { "type": "string", "format": "uri", "maxLength": 2048 }
      }
    },
    "changelog": {
      "type": "string",
      "format": "uri",
      "maxLength": 2048
    },
    "publisher": {
      "type": "string",
      "maxLength": 128,
      "description": "Registry publisher handle. Set by registry on publish, not by skill author."
    },
    "visibility": {
      "type": "string",
      "enum": ["public", "private"],
      "default": "private",
      "description": "Registry visibility. private until explicitly published."
    },
    "engines": {
      "type": "object",
      "additionalProperties": false,
      "maxProperties": 4,
      "properties": {
        "node":   { "type": "string", "maxLength": 32 },
        "python": { "type": "string", "maxLength": 32 },
        "bash":   { "type": "string", "maxLength": 32 },
        "deno":   { "type": "string", "maxLength": 32 }
      },
      "description": "Advisory. Runtime version requirements for scripts bundled in scripts/. Not enforced by GoodBoy — shown to user before install."
    },
    "os": {
      "type": "array",
      "items": { "type": "string", "enum": ["darwin", "linux", "win32"] },
      "maxItems": 3,
      "uniqueItems": true,
      "description": "Advisory. Operating systems this skill's scripts are compatible with. Not enforced — shown to user before install."
    },
    "permissions": {
      "type": "array",
      "items": { "type": "string", "enum": ["read_files", "write_files", "network", "shell", "env"] },
      "maxItems": 5,
      "uniqueItems": true,
      "description": "DECLARED INTENT ONLY — not enforced at runtime. Skill authors declare what their scripts intend to access. GoodBoy displays this to users before install as a trust signal. An empty array or omitted field means no elevated access is claimed."
    },
    "requires": {
      "type": "object",
      "additionalProperties": false,
      "required": ["secrets"],
      "properties": {
        "secrets": {
          "type": "array",
          "items": {
            "type": "string",
            "pattern": "^[A-Z_][A-Z0-9_]*$",
            "maxLength": 64
          },
          "minItems": 1,
          "maxItems": 32,
          "uniqueItems": true,
          "description": "Logical secret names (environment-variable style) this skill requires at runtime. DECLARED INTENT ONLY — GoodBoy validates and displays these; it never resolves or injects them during install, and never executes the skill."
        }
      },
      "description": "Logical runtime requirements. Introduced in schema 1.1.0; manifests using this field must declare schema_version >= 1.1.0."
    }
  }
}
